{
  "schema_version": 1,
  "consumer_repository": "hhaus-org-test/marketing-site-e2e",
  "source_repository": "hhaus-org/hhaus-org.github.io",
  "source_revision": "daee1537313aed1951c0c8df7281a154c0b79f3a",
  "source_pull_request": "https://github.com/hhaus-org/hhaus-org.github.io/pull/1",
  "framework": "astro",
  "package_manager": "npm",
  "revision_policy": "immutable_40_character_sha",
  "source_access": "read_only",
  "production_mutation_allowed": false
}
